number,value,datetime_start,datetime_complete,duration,params_batch_size,params_channels,params_dropout,params_lr,params_weight_decay,system_attrs_tpe:relative_params:0,state
0,0.9972825284300695,2026-10-03 11:53:50.208065,2026-10-03 11:56:30.097984,0 days 00:02:39.889919,16,wide,0.30000000000000004,0.0003574712922600243,0.0006796578090758161,,COMPLETE
1,0.9972826086956521,2026-10-03 11:56:30.150427,2026-10-03 11:59:00.268162,0 days 00:02:30.117735,16,wide,0.2,0.00010725209743172001,1.461896279370496e-05,,COMPLETE
2,0.9945725016569703,2026-10-03 11:59:00.307345,2026-10-03 12:00:47.433933,0 days 00:01:47.126588,64,medium,0.30000000000000004,0.0008012737503998541,1.5339162591163623e-06,,COMPLETE
3,0.9945577125593162,2026-10-03 12:00:47.472649,2026-10-03 12:01:55.179402,0 days 00:01:07.706753,64,small,0.4,0.0007896186801026692,5.762487216478604e-05,,COMPLETE
4,0.9945688894603671,2026-10-03 12:01:55.222409,2026-10-03 12:03:35.114944,0 days 00:01:39.892535,64,medium,0.30000000000000004,0.00015144860262751404,5.4880470007660465e-06,,COMPLETE
5,0.9582676319393918,2026-10-03 12:03:35.151476,2026-10-03 12:04:11.272236,0 days 00:00:36.120760,32,medium,0.0,0.0027051668818999287,2.0013420622879995e-05,,PRUNED
6,0.9931991073701758,2026-10-03 12:04:11.303498,2026-10-03 12:05:42.393377,0 days 00:01:31.089879,32,wide,0.0,0.00037507963596256056,0.008862326508576254,,PRUNED
7,0.989145043118671,2026-10-03 12:05:42.421020,2026-10-03 12:06:40.025365,0 days 00:00:57.604345,64,tapered,0.2,0.0013826083091896758,2.907208890659845e-06,,PRUNED
8,0.9891654070776539,2026-10-03 12:06:40.058947,2026-10-03 12:07:44.227499,0 days 00:01:04.168552,16,tapered,0.5,0.0018832519048593583,7.742116473996259e-05,,PRUNED
9,0.9687404432681818,2026-10-03 12:07:44.263661,2026-10-03 12:08:06.764315,0 days 00:00:22.500654,32,small,0.0,0.00015019490572374368,2.7012557725439094e-06,,PRUNED
10,0.9823354760354105,2026-10-03 12:08:06.790761,2026-10-03 12:08:47.284142,0 days 00:00:40.493381,16,small,0.0,0.0006986856245263062,2.118885583794475e-05,"{""batch_size"": 16, ""channels"": ""small"", ""dropout"": 0.0, ""lr"": 0.0006986856245263062, ""weight_decay"": 2.118885583794475e-05}",PRUNED
11,0.9972826086956521,2026-10-03 12:08:47.323983,2026-10-03 12:11:18.261897,0 days 00:02:30.937914,16,wide,0.30000000000000004,0.00016437650366236544,0.0002038087222201465,"{""batch_size"": 16, ""channels"": ""wide"", ""dropout"": 0.30000000000000004, ""lr"": 0.00016437650366236544, ""weight_decay"": 0.0002038087222201465}",COMPLETE
12,0.9932064715742526,2026-10-03 12:11:18.303502,2026-10-03 12:12:48.942519,0 days 00:01:30.639017,16,wide,0.1,0.0003582764721279135,7.456891241749364e-06,"{""batch_size"": 16, ""channels"": ""wide"", ""dropout"": 0.1, ""lr"": 0.0003582764721279135, ""weight_decay"": 7.456891241749364e-06}",PRUNED
13,0.9986412943148505,2026-10-03 12:12:48.976385,2026-10-03 12:15:16.340506,0 days 00:02:27.364121,32,wide,0.5,0.00015046968522678937,0.00011316519689017485,"{""batch_size"": 32, ""channels"": ""wide"", ""dropout"": 0.5, ""lr"": 0.00015046968522678937, ""weight_decay"": 0.00011316519689017485}",COMPLETE
14,0.9836949919313251,2026-10-03 12:15:16.385090,2026-10-03 12:16:17.010102,0 days 00:01:00.625012,16,wide,0.1,0.00011394329437498397,2.6849503203090204e-06,"{""batch_size"": 16, ""channels"": ""wide"", ""dropout"": 0.1, ""lr"": 0.00011394329437498397, ""weight_decay"": 2.6849503203090204e-06}",PRUNED
15,0.9782873993514211,2026-10-03 12:16:17.059450,2026-10-03 12:17:16.479461,0 days 00:00:59.420011,32,wide,0.5,0.00021194884967943477,0.00015924367340319217,"{""batch_size"": 32, ""channels"": ""wide"", ""dropout"": 0.5, ""lr"": 0.00021194884967943477, ""weight_decay"": 0.00015924367340319217}",PRUNED
16,0.9685774371594644,2026-10-03 12:17:16.509945,2026-10-03 12:17:51.434859,0 days 00:00:34.924914,32,medium,0.2,0.00011823327912421688,0.0003334178904251464,"{""batch_size"": 32, ""channels"": ""medium"", ""dropout"": 0.2, ""lr"": 0.00011823327912421688, ""weight_decay"": 0.0003334178904251464}",PRUNED
17,0.9514265290297568,2026-10-03 12:17:51.465839,2026-10-03 12:18:40.887810,0 days 00:00:49.421971,16,tapered,0.1,0.0001307618800191869,2.7189535900032382e-05,"{""batch_size"": 16, ""channels"": ""tapered"", ""dropout"": 0.1, ""lr"": 0.0001307618800191869, ""weight_decay"": 2.7189535900032382e-05}",PRUNED
18,0.9782900066278812,2026-10-03 12:18:40.919769,2026-10-03 12:19:38.715738,0 days 00:00:57.795969,64,wide,0.5,0.0001142643550687004,5.444650953120663e-06,"{""batch_size"": 64, ""channels"": ""wide"", ""dropout"": 0.5, ""lr"": 0.0001142643550687004, ""weight_decay"": 5.444650953120663e-06}",PRUNED
19,0.9918437816366317,2026-10-03 12:19:38.756518,2026-10-03 12:21:17.880735,0 days 00:01:39.124217,32,wide,0.5,0.0003069565459561566,1.1630585000626343e-05,"{""batch_size"": 32, ""channels"": ""wide"", ""dropout"": 0.5, ""lr"": 0.0003069565459561566, ""weight_decay"": 1.1630585000626343e-05}",PRUNED
20,0.9986412943148505,2026-10-03 12:21:17.910862,2026-10-03 12:23:44.936157,0 days 00:02:27.025295,32,wide,0.2,0.0001852978044838338,6.056244516283527e-05,"{""batch_size"": 32, ""channels"": ""wide"", ""dropout"": 0.2, ""lr"": 0.0001852978044838338, ""weight_decay"": 6.056244516283527e-05}",COMPLETE
21,0.9945688894603671,2026-10-03 12:23:44.969989,2026-10-03 12:25:55.190336,0 days 00:02:10.220347,16,wide,0.30000000000000004,0.00011448168763817758,4.2094444164364414e-05,"{""batch_size"": 16, ""channels"": ""wide"", ""dropout"": 0.30000000000000004, ""lr"": 0.00011448168763817758, ""weight_decay"": 4.2094444164364414e-05}",PRUNED
22,0.9986412943148505,2026-10-03 12:25:55.217951,2026-10-03 12:28:22.904624,0 days 00:02:27.686673,32,wide,0.2,0.0002136482394029822,0.00039348061060171967,"{""batch_size"": 32, ""channels"": ""wide"", ""dropout"": 0.2, ""lr"": 0.0002136482394029822, ""weight_decay"": 0.00039348061060171967}",COMPLETE
23,0.9945725016569703,2026-10-03 12:28:22.938554,2026-10-03 12:30:30.930050,0 days 00:02:07.991496,32,wide,0.2,0.00036304582382590565,0.00022298462455504664,"{""batch_size"": 32, ""channels"": ""wide"", ""dropout"": 0.2, ""lr"": 0.00036304582382590565, ""weight_decay"": 0.00022298462455504664}",PRUNED
24,0.9986412943148505,2026-10-03 12:30:30.960202,2026-10-03 12:32:59.044798,0 days 00:02:28.084596,32,wide,0.1,0.0002305573981020049,5.190641109980612e-05,"{""batch_size"": 32, ""channels"": ""wide"", ""dropout"": 0.1, ""lr"": 0.0002305573981020049, ""weight_decay"": 5.190641109980612e-05}",COMPLETE
